objectid,filename,youtubeid,vimeoid,title,creator,date,description,subject,location,latitude,longitude,source,identifier,type,format,language,rights,rightsstatement
crrock0001,locandina ARCI_Flamenco_2001-2002.pdf,,,"Corso di chitarra flamenca, ARCI, 2001/2002",Circolo ARCI Luogocomune,2001-10,"Volantino del corso di chitarra Flamenca della Scuola Popolare di Musica, docente Juan Lorenzo",Scuola Popolare di Musica;chitarra flamenca; Juan Lorenzo; Luogocomune,Circolo ARCI Luogocomune,45.1347378,10.03033615,Aldo Pini,ARCI_flamenco_01,Image,document/pdf,it,Public domain,http://rightsstatements.org/vocab/NoC-US/1.0/
crrock0002,Diskanto_Radioulna_CB.pdf,,,"Diskanto, Radioulna, 1987",Diskanto,1987-05,"Demotape dei Diskanto, musicassetta",Diskanto; Loris Durando; Max Mondello; Marco Turati; Auro Sissa,"Via Grado 11, Cremona",45.1400986,10.01194248,MarcoTurati,Diskanto_radioulna_1987,Image,document/pdf,it,Public domain,http://rightsstatements.org/vocab/NoC-US/1.0/
crrock0003,Cremona Rock_1988_gruppi_CB.pdf,,,"Cremona Rock 1988, presentazione gruppi",Janggos,1988-06-07,Presentazione dei gruppi locali che parteciparono alla rassegna CremonaRock nel 1988,CremonaRock 1988; Janggos; Il Cascinetto; On Line; Not Fade Away; Lix Bolero; Leyda,Il Cascinetto,45.13698532,10.04966163,MarcoTurati,CremonaRock 1988_gruppi,Image,document/pdf,it,Public domain,http://rightsstatements.org/vocab/NoC-US/1.0/
crrock0004,Cascinetto_-_Convenzione_Comune_Cremona.pdf,,,"Convenzione tra il comune di Cremona e l'Associazione culturale ""Gruppo Janggos""",,1992-12-11,Atto comunale,Comune di Cremona; Il Cascinetto; Janggos; Fabio Enzo Caso,Palazzo municipale di Cremona,45.13075,10.02374,Marco Turati,Cascinetto_-_Convenzione_Comune_Cremona,Image,document/pdf,it,Public domain,http://rightsstatements.org/vocab/NoC-US/1.0/
crrock0005,,,,Allan Holdsworth Quartet - Cremona Jazz 1992,Comune di Cremona ,1992-04-25,"Programma di sala del concerto degli Allan Holdsworth quartet a Palazzo Cittanova. Nella stessa location, la domenica 26 Aprile si tiene il Seminario di Musica d'Insieme ""Allan Holdsworth quartet"" ","Allan Holdsworth Quartet; Cremona jazz 1992; Comune di Cremona; Arcinova; Il Cascinetto; Teatro Comunale ""A. Ponchielli""; Allan Holdsworth; Skuli Sverrisson; Steve Hunt; Chad Wackerman; Roberto Cecchetto;",Palazzo Cittanova,45.1380394,10.01709018,Janggos,,Image,document/pdf,it,Public domain,http://rightsstatements.org/vocab/NoC-US/1.0/
crrock0006,,,,Defunkt - Cremona Jazz 1992,Comune di Cremona ,1992-04-29,Programma di sala del concerto dei Defunkt a Palazzo Cittanova,"Defunkt; Cremona jazz 1992; Comune di Cremona; Arcinova; Il Cascinetto; Teatro Comunale ""A. Ponchielli""; Joseph Bowie; Byron Bowie; John Mulkerin; Kevin Bents; Bill Bickford; Kim Clarke; Kenny Martin;",Palazzo Cittanova,45.1380394,10.01709018,Janggos,,Image,document/pdf,it,Public domain,http://rightsstatements.org/vocab/NoC-US/1.0/
crrock0007,,,,Defunkt - Cremona Jazz 1992,Comune di Cremona ,1992-04-29,Locandina A3 cartaceo del concerto dei Defunkt del Cremona Jazz 1992,"Defunkt; Cremona jazz 1992; Comune di Cremona; Arcinova; Il Cascinetto; Teatro Comunale ""A. Ponchielli""; Joseph Bowie; Byron Bowie; John Mulkerin; Kevin Bents; Bill Bickford; Kim Clarke; Kenny Martin;",Palazzo Cittanova,45.1380394,10.01709018,Janggos,,Image,document/pdf,it,Public domain,http://rightsstatements.org/vocab/NoC-US/1.0/
crrock0008,,,,Allan Holdsworth Quartet - Cremona Jazz 1992,Comune di Cremona ,1992-04-25,Locandina A3 cartaceo del concerto dei Allan Holdsworth Quartet del Cremona Jazz 1992,"Allan Holdsworth Quartet; Cremona jazz 1992; Comune di Cremona; Arcinova; Il Cascinetto; Teatro Comunale ""A. Ponchielli""; Allan Holdsworth; Skuli Sverrisson; Steve Hunt; Chad Wackerman; Roberto Cecchetto;",Palazzo Cittanova,45.1380394,10.01709018,Janggos,,Image,document/pdf,it,Public domain,http://rightsstatements.org/vocab/NoC-US/1.0/
crrock0009,,,,Eugenio Colombo Solo - Arcado String Trio - Cremona Jazz 1992,Comune di Cremona ,1992-04-05,Locandina A3 cartaceo del concerto di Eugenio Colombo Solo e degli Arcado String Trio del Cremona Jazz 1992,"Eugenio Colombo; Arcado String Trio; Cremona jazz 1992; Comune di Cremona; Arcinova; Il Cascinetto; Teatro Comunale ""A. Ponchielli""; Hank Roberts; Mark Dresser; Mark Feldman; ",Palazzo Cittanova,45.1380394,10.01709018,Janggos,,Image,document/pdf,it,Public domain,http://rightsstatements.org/vocab/NoC-US/1.0/
crrock0010,,,,Elvin Jones Jazz Machine - Cremona Jazz 1992,Comune di Cremona ,1992-03-31,Locandina A3 cartaceo del concerto degli Elvin Jones Jazz Machine del Cremona Jazz 1992,"Elvin Jones Jazz Machine; Cremona jazz 1992; Comune di Cremona; Arcinova; Il Cascinetto; Teatro Comunale ""A. Ponchielli""; Elvin Jones; Wilie Pickins; Sonny Fortune; Ravi Coltrane; Nicholas A. Payton; Chip Jackson;",Palazzo Cittanova,45.1380394,10.01709018,Janggos,,Image,document/pdf,it,Public domain,http://rightsstatements.org/vocab/NoC-US/1.0/
crrock0011,,,,Duo Bley-Peacock  - Cremona Jazz 1992,Comune di Cremona ,1992-03-25,Locandina A3 cartaceo del concerto del Duo Bley-Peacock del Cremona Jazz 1992,"Duo Bley-Peacock; Cremona jazz 1992; Comune di Cremona; Arcinova; Il Cascinetto; Teatro Comunale ""A. Ponchielli""; Paul Bley; Gary Peacock;",Palazzo Cittanova,45.1380394,10.01709018,Janggos,,Image,document/pdf,it,Public domain,http://rightsstatements.org/vocab/NoC-US/1.0/
crrock0012,,,,G.O. N. Grande Orchestra Nazionale dell'A.M.J. - Cremona Jazz 1992 ,Comune di Cremona ,1992-03-14,Locandina A3 cartaceo del concerto della G.O. N. Grande Orchestra Nazionale dell'A.M.J. (Associazione Musicisti Jazz) del Cremona Jazz 1992,"G.O. N. Grande Orchestra Nazionale dell'A.M.J.; Cremona jazz 1992; Comune di Cremona; Arcinova; Il Cascinetto; Teatro Comunale ""A. Ponchielli""; Gerardo Iacoucci; Emilio Soana; Pino Minafra; Flavio Boltro; Paolo Fresu; Marco Tamburini; Rudi Migliardi; Roberto Rossi; Marcello Rosa; Danilo Terenzi; Fiorenzo Calandris; Martin Mayes; Gianluigi Trovesi; Riccardo Luppi; Roberto Ottaviano; Claudio Fasoli; Daniele Cavallanti; Stefano Battaglia; Sandro Gibellini; Paolino Dalla Porta; Giampiero Prina; Tiziano Tononi;","Teatro Comunale ""A. Ponchielli""",45.1325631,10.01892817,Janggos,,Image,document/pdf,it,Public domain,http://rightsstatements.org/vocab/NoC-US/1.0/
crrock0013,,,,Cremona Jazz 1992,Comune di Cremona ,1992-03-14,Depliant formato 10x21 del Cremona Jazz 1992. Al suo interno il programma di tutti gli eventi previsti dal 14 Marzo al 29 Aprile,"G.O. N. Grande Orchestra Nazionale dell'A.M.J.; Duo Bley-Peacock; Elvin Jones Jazz Machine; Eugenio Colombo; Arcado String Trio; Allan Holdsworth Quartet; Defunkt; Cremona jazz 1992; Comune di Cremona; Arcinova; Il Cascinetto; Teatro Comunale ""A. Ponchielli""; Gerardo Iacoucci; Emilio Soana; Pino Minafra; Flavio Boltro; Paolo Fresu; Marco Tamburini; Rudi Migliardi; Roberto Rossi; Marcello Rosa; Danilo Terenzi; Fiorenzo Calandris; Martin Mayes; Gianluigi Trovesi; Riccardo Luppi; Roberto Ottaviano; Claudio Fasoli; Daniele Cavallanti; Stefano Battaglia; Sandro Gibellini; Paolino Dalla Porta; Giampiero Prina; Tiziano Tononi; Gerardo Iacoucci; Emilio Soana; Pino Minafra; Flavio Boltro; Paolo Fresu; Marco Tamburini; Rudi Migliardi; Roberto Rossi; Marcello Rosa; Danilo Terenzi; Fiorenzo Calandris; Martin Mayes; Gianluigi Trovesi; Riccardo Luppi; Roberto Ottaviano; Claudio Fasoli; Daniele Cavallanti; Stefano Battaglia; Sandro Gibellini; Paolino Dalla Porta; Giampiero Prina; Tiziano Tononi; Paul Bley; Gary Peacock; Elvin Jones; Wilie Pickins; Sonny Fortune; Ravi Coltrane; Nicholas A. Payton; Chip Jackson; Hank Roberts; Mark Dresser; Mark Feldman; Allan Holdsworth; Skuli Sverrisson; Steve Hunt; Chad Wackerman; Roberto Cecchetto; Joseph Bowie; Byron Bowie; John Mulkerin; Kevin Bents; Bill Bickford; Kim Clarke; Kenny Martin;","Teatro Comunale ""A. Ponchielli""",45.1325631,10.01892817,Janggos,,Image,document/pdf,it,Public domain,http://rightsstatements.org/vocab/NoC-US/1.0/
ccrock0014,CremonaRock_88_depliant.pdf,,,Cremona Rock 1988 - Rassegna dei gruppi musicali cremonesi,Comune di Cremona ,1988-06-07,Depliant formato 10x21 del Cremona Rock 1988. Rassegna dei gruppi che hanno partecipato alle edizioni fino al 1987,CremonaRock 1988; Janggos; Porta Mosa; Centro Musica; Vanadium; Paolo Fresu Quintet; Not Moving; Letto a Strisce; Chiamata Urgente; Strana Officina; Skanners; Hot Ice Cream; Mob Exported; Demetrio Stratos; Diskanto; Quasar; Comune di Cremona,Fiera di Cremona,45.15108944,10.03222674,Janggos,CremonaRock_88,Image,document/pdf,it,Public domain,http://rightsstatements.org/vocab/NoC-US/1.0/
ccrock0015,CremonaRock_90_volantino.pdf,,,Cremona Rock 1990,Comune di Cremona ,1990-06-02,Formato A5,CremonaRock 1990; Janggos; Centro Musica; Il Cascinetto; Comune di Cremona; Malcolm X; Kina; The Orphans; Marlene Kuntz; Under Neath What; Avanguardia; Skiantos; Seven Kevins; Kunsertu; The Underground Arrows; The Celibate Rifles; Crazy Hammer; Rabid Duck; Negazione; De Corto; Lix Bolero; Rats; Comune di Cremona,Fiera di Cremona,45.15108944,10.03222674,Janggos,,Image,document/pdf,it,Public domain,http://rightsstatements.org/vocab/NoC-US/1.0/
ccrock0016,CremonaJazz_92_manifesto.pdf,,,Cremona Jazz 1992,Comune di Cremona ,1992-03-14,Manifesto 70x100 cartaceo con il programma di tutti gli eventi previsti dal 14 Marzo al 29 Aprile,"G.O. N. Grande Orchestra Nazionale dell'A.M.J.; Duo Bley-Peacock; Elvin Jones Jazz Machine; Eugenio Colombo; Arcado String Trio; Allan Holdsworth Quartet; Defunkt; Cremona jazz 1992; Comune di Cremona; Arcinova; Il Cascinetto; Teatro Comunale ""A. Ponchielli""; Gerardo Iacoucci; Emilio Soana; Pino Minafra; Flavio Boltro; Paolo Fresu; Marco Tamburini; Rudi Migliardi; Roberto Rossi; Marcello Rosa; Danilo Terenzi; Fiorenzo Calandris; Martin Mayes; Gianluigi Trovesi; Riccardo Luppi; Roberto Ottaviano; Claudio Fasoli; Daniele Cavallanti; Stefano Battaglia; Sandro Gibellini; Paolino Dalla Porta; Giampiero Prina; Tiziano Tononi; Gerardo Iacoucci; Emilio Soana; Pino Minafra; Flavio Boltro; Paolo Fresu; Marco Tamburini; Rudi Migliardi; Roberto Rossi; Marcello Rosa; Danilo Terenzi; Fiorenzo Calandris; Martin Mayes; Gianluigi Trovesi; Riccardo Luppi; Roberto Ottaviano; Claudio Fasoli; Daniele Cavallanti; Stefano Battaglia; Sandro Gibellini; Paolino Dalla Porta; Giampiero Prina; Tiziano Tononi; Paul Bley; Gary Peacock; Elvin Jones; Wilie Pickins; Sonny Fortune; Ravi Coltrane; Nicholas A. Payton; Chip Jackson; Hank Roberts; Mark Dresser; Mark Feldman; Allan Holdsworth; Skuli Sverrisson; Steve Hunt; Chad Wackerman; Roberto Cecchetto; Joseph Bowie; Byron Bowie; John Mulkerin; Kevin Bents; Bill Bickford; Kim Clarke; Kenny Martin","Teatro Comunale ""A. Ponchielli""",45.1325631,10.01892817,Janggos,,Image,document/pdf,it,Public domain,http://rightsstatements.org/vocab/NoC-US/1.0/
ccrock0017,CremonaJazz_91_locandina.pdf,,,Cremona Jazz 1991,Comune di Cremona ,1991-02-20,Locandina A3 con il programma degli eventi dal 20 febbraio all'11 aprile,"CremonaJazz 1991; Comune di Cremona; Arcinova; Il Cascinetto; Teatro Comunale ""A. Ponchielli""; Palazzo Cittanova; Faiella Quartet; Dario Faiella; Michael Rosen; Rosario Bonaccorso; Christian Meyer; Kenny Wheeler gropu; Kenny Wheeler; Franco D'Andrea; Wayne Darling; Bill Elgart; Mike Stern Trio; Mike Stern; Lincoln Goines; Ben Perowsky; Lol Coxhill's Before My Time; Lol Coxhill; Nick Stephens; Roger Turner; Paul Rutherford; Maceo Parker's Roots Revisited group; Maceo Parker; Fred Wesley;  Pee Wee Ellis; Rodney Jones; Larry Goldinds; Jimmy Madison; Cassandra Wilson quartet; Cassandra Wilson; James Weidman; Kevin Bruce Harris; Mark Johnson; Oliver Lake quartet; Oliver Lake; Anthony Peterson; Darrel Mixon; Eli Fontaine; John Mc. Laughlin trio; John Mc. Laughlin; Dominique Di Piazza; Trilok Gurtu; Palle Danielsson quartet; Palle Danielsson; Rita Marcotulli; Andres Kjellberg; Joakim Milder",Palazzo Cittanova,45.1380394,10.01709018,Janggos,,Image,document/pdf,it,Public domain,http://rightsstatements.org/vocab/NoC-US/1.0/
ccrock0018,CremonaRock_88_Manifesto_Tolo_Marton.jpg,,,Cremona Rock 1988,Comune di Cremona ,1988-06-28,Manifesto 70x100,CremonaRock 1988; Tolo Marton Band; Il Cascinetto; Quartiere 4; Janggos; Comune di Cremona; Progetto giovani; Area spettacoli; Fiera di Cremona; Ca' de Somenzi,"Fiera di Cremona, Ca' de Somenzi",45.15110457,10.03211945,Janggos,,Image,document/jpg,it,Public domain,http://rightsstatements.org/vocab/NoC-US/1.0/
ccrock0019,CremonaJazz_1988_Festival.pdf,,,Cremona Jazz 1988 Festival,Comune di Cremona,1988-02-23,Formato A5 cartaceo con il programma di tutte le serate dal 23 febbraio 29 aprile 1988,"CremonaJazz 1988; Festival; Centro Musica; Comune di Cremona; Arci Cremona; Sala Stratos; teatro Comunale ""A. Ponchielli""; Tim Berne; Hank Roberts; Joey Baron; Tim Berne Trio ""Miniature""; Giulio Visibelli; Workshop;""Il Centro""; Niels H. Ø. Pedersen Trio;  Niels H. Ø. Pedersen; Kenny Drew; Philiph Catherine; Dave Brubeck Quartet; Dave Brubeck; Randy Jones; Chris Brubeck; Bill Smith; Wayne Shorter Quintet; Wayne Shorter; Gery Allen; Patrice Rushen; Nathan East; Terri Lyne Carrington; Gabriella Ravazzi; Mal Waldrom; Seminario; Canto jazz; Enrico Rava Quartet; Enrico Rava; Augusto Mancinelli; Furio Di Castro; Mauro Beggio; Hermeto Pascoal Sextet; Hermeto Pascoal; Jovino Santos; Carlos Malta; Marcio Bahia; Pernambuco; Sestetto",Sala Stratos,45.13473833,10.02133322,Janggos,,Image,document/pdf,it,Public domain,http://rightsstatements.org/vocab/NoC-US/1.0/
ccrock0020,Portamosa_87_Manifesto.JPG,,,Portamosa 1987,Comune di Cremona,1987-05-30,Manifesto 70x100,Portamosa; Comune di Cremona; Il Cascinetto; Janggos; Banda Magnetica; Banana Arways Band; Lix Bolero; Not Fade Away; Stealth; Gypsy; Nevrotic Sisma; Emicrania; Crazy Rebels; Diskanto; Underground Life; Leyda; Mr. Hyde; Napalm; Strana Officina; White Line; Letto a Strisce; Slang; Senso Unico; Crazy Hammer; Special Force; Skanners; Alive Rhyme; Ca'fewien,Portamosa,45.12913417,10.03093364,Janggos,,Image,document/jpg,it,Public domain,http://rightsstatements.org/vocab/NoC-US/1.0/
ccrock0021,Portamosa_86_pieghevole.pdf,,,Portamosa 1986,Comune di Cremona,1986-06-01,Pieghevole,"Portamosa; Comune di Cremona; Janggos; Vanadium; Angelkillers; Angel, Killers; Nevrotic Sisma; Paolo Fresu, Paolo Fresu Quintet; Not Moving; Leyda; Letto a strisce; Senso Unico; Chiamata urgente; Diskanto; Fabio goes to Iseo; Emicrania; Napalm; Gipsy; Downtown Saints; Arci-Comics; Mostra Musica e fumetto",,45.12913417,10.03093364,Janggos,,pdf,,,,
ccrock0022,Portamosa_85_proiezione.jpg,,,Portamosa 1985,Comune di Cremona,1985-09-14,A4,Portamosa; Comune di Cremona; Janggos; diapositive; proiezione,,45.12913417,10.03093364,Janggos,,image,,,,
ccrock0023,Portamosa_85_Serata_di_Danza.pdf,,,Portamosa 1985,Comune di Cremona,1985-06-11,A4,"Portamosa; Comune di Cremona; Janggos; dance studio ""C""; scuola di Danza CIrcolo Fodri; Giada Orio; Stefano Benedini; Slapstick; Arci",,45.12913417,10.03093364,Janggos,,,,,,
ccrock0024,CremonaRock_88_Manifesto_Diaframma.jpg,,,Cremona Rock 1988,Comune di Cremona,1988-06-24,Manifesto 70x100,CremonaRock 1988; Diaframma; Boxing tour 1988; Janggos; Comune di Cremona; Il Cascinetto; Area spettacoli; Fiera di Cremona; Ca' de Somenzi,"Fiera di Cremona, Ca' de Somenzi",45.15110457,10.03211945,Janggos,,Image,document/jpg,it,Public domain ,http://rightsstatements.org/vocab/NoC-US/1.0/
ccrock0025,Portamosa_85_pieghevole.pdf,,,Portamosa 1985,Comune di Cremona,1985-06-04,A3,"Portamosa; Comune di Cremona; Quasar; Gipsy; Downtown Saints; Foris Portam; Scuola Danza Circolo Fodri; Scuola Dance Studio ""C""; Gruppo danza contemporanea ""slapstick""; Scuola danza contemporanea dell'Arci;Hot Ice Cream; Mob Exported; Senso UNico; Nan-sho-kho; Napalm; Nevrotic Sisma; Leyda; Clipper; Not Self; Emicrania",,,,,,,,,,
ccrock0026,CremonaRock_88_Manifesto.jpg,,,Cremona Rock 1988,Comune di Cremona,1988-06-07,Manifesto 70x100,CremonaRock 1988; Comune di Cremona; Progetto giovani; Quartiere 4; Janggos; Il Cascinetto; Area spettacoli; Fiera di Cremona; Ca' de Somenzi; Demetrio Stratos; Not Fade Away; The Gang; Crying Steel; Sabotage; On Line; Atelier Nouveau; Skiantos; Lix Bolero; Diaframma; Leyda; Tolo Marton,"Fiera di Cremona, Ca' de Somenzi",45.15110457,10.03211945,Janggos,,Image,document/jpg,it,Public domain,http://rightsstatements.org/vocab/NoC-US/1.0/
ccrock0027,CremonaRock_88_Manifesto_Skiantos.jpg,,,Cremona Rock 1988,Comune di Cremona,1988-06-18,Manifesto 70x100,,,,,,,,,,,
ccrock0028,,,,,,,,,,,,,,,,,,